{
  "audit": {
    "adapter": {
      "detection_markers": [
        "CLAUDE.md",
        "CLAUDE.local.md",
        ".mcp.json"
      ],
      "id": "claude-code",
      "instruction_inventory": {
        "native_patterns": [
          "AGENTS.md",
          "CLAUDE.md",
          "CLAUDE.local.md"
        ],
        "state": "available"
      },
      "local_session_usage": {
        "fallback": "measurement_csv",
        "state": "unavailable"
      },
      "task_outcomes": {
        "fallback": "measurement_csv",
        "state": "unavailable"
      },
      "tool_definition_dump": {
        "source": "explicit_input",
        "state": "available"
      },
      "workspace_tool_config": {
        "paths": [
          ".mcp.json"
        ],
        "root_keys": [
          "mcpServers"
        ],
        "state": "available"
      }
    },
    "assumptions": {
      "assistant": 600,
      "cache_discount": 0.1,
      "chars_per_token": 4.0,
      "measurement_kind": "estimated",
      "model_session": false,
      "price_cached": null,
      "price_input": null,
      "price_output": null,
      "tokens_per_tool": null,
      "tool_output": 1200,
      "tools_per_server": 10,
      "turns": 20,
      "user": 150,
      "warn": 2500
    },
    "document_type": "ace.audit",
    "findings": [
      {
        "action_boundary": "review on-demand reference; no workspace change is made",
        "baseline": 2554,
        "baseline_metric_id": "instruction-standing-tokens",
        "evidence": [
          "src-6ebdb617a810"
        ],
        "id": "oversized-instruction-1",
        "impact": "standing instruction cost",
        "unit": "tokens"
      }
    ],
    "id": "sha256:2110cee7da3e93f79dea01415c69ba310558a9fe6e474c9a86f80cbf02bc9396",
    "manifest": [
      {
        "mode": "0644",
        "path": ".mcp.json",
        "role": "context",
        "sha256": "sha256:98a209c0b646badef4136fe3aa9d914d8062ecfcb3fcb1d571bce5bd4b2e7232"
      },
      {
        "mode": "0644",
        "path": "CLAUDE.md",
        "role": "instruction",
        "sha256": "sha256:cd74a0c98a90e7b6cfe64a6d084789bd827ca7d254af8e20363e097ff402fc05"
      }
    ],
    "manifest_digest": "sha256:219d00b978e90562c8bf4dfb0f096cecf9b643b9420129d7fdf2009296e46bac",
    "measurement": null,
    "metrics": [
      {
        "calculation": "sum(round(utf8_replacement_characters / chars_per_token))",
        "classification": "estimated",
        "confidence": "medium",
        "id": "instruction-standing-tokens",
        "name": "instruction standing tokens",
        "source_ids": [
          "src-6ebdb617a810"
        ],
        "unit": "tokens_per_turn",
        "value": 2554
      },
      {
        "calculation": "sum(regular text file bytes)",
        "classification": "measured",
        "confidence": "high",
        "id": "context-bytes",
        "name": "readable context bytes",
        "source_ids": [
          "src-6ebdb617a810",
          "src-d5d3368a61f8"
        ],
        "unit": "bytes",
        "value": 10286
      },
      {
        "calculation": "sum(per-file round(characters / chars_per_token))",
        "classification": "estimated",
        "confidence": "medium",
        "id": "context-estimated-tokens",
        "name": "readable context estimate",
        "source_ids": [
          "src-6ebdb617a810",
          "src-d5d3368a61f8"
        ],
        "unit": "tokens",
        "value": 2572
      },
      {
        "calculation": "server_count * tools_per_server * tokens_per_tool_low",
        "classification": "estimated",
        "confidence": "low",
        "id": "tool-standing-tokens-low",
        "name": "tool standing estimate low",
        "source_ids": [
          "src-d5d3368a61f8"
        ],
        "unit": "tokens_per_turn",
        "value": 1000
      },
      {
        "calculation": "server_count * tools_per_server * tokens_per_tool_high",
        "classification": "estimated",
        "confidence": "low",
        "id": "tool-standing-tokens-high",
        "name": "tool standing estimate high",
        "source_ids": [
          "src-d5d3368a61f8"
        ],
        "unit": "tokens_per_turn",
        "value": 5000
      }
    ],
    "schema_version": 1,
    "sources": [
      {
        "id": "src-d5d3368a61f8",
        "mode": "0644",
        "path": ".mcp.json",
        "role": "context",
        "sha256": "sha256:98a209c0b646badef4136fe3aa9d914d8062ecfcb3fcb1d571bce5bd4b2e7232"
      },
      {
        "id": "src-6ebdb617a810",
        "mode": "0644",
        "path": "CLAUDE.md",
        "role": "instruction",
        "sha256": "sha256:cd74a0c98a90e7b6cfe64a6d084789bd827ca7d254af8e20363e097ff402fc05"
      }
    ],
    "status": "ok",
    "unknowns": []
  },
  "audit_id": "sha256:2110cee7da3e93f79dea01415c69ba310558a9fe6e474c9a86f80cbf02bc9396",
  "bindings": [
    {
      "mode": "0644",
      "path": "CLAUDE.md",
      "postimage_sha256": "sha256:70abfb1ceab9fb33ca182878fb9089d96ff27971f2b6cd64f3a635b484b09d8a",
      "preimage_sha256": "sha256:cd74a0c98a90e7b6cfe64a6d084789bd827ca7d254af8e20363e097ff402fc05"
    },
    {
      "mode": "0644",
      "must_be_absent": true,
      "path": "docs/agent-reference/claude-md-cd74a0c98a90.md",
      "postimage_sha256": "sha256:8c1ca9e3638332a52dbe897990d8d64b5232f80677b432c6bc1673be844085ca"
    }
  ],
  "candidate_id": "sha256:84df8b08951aec1015fc0e5bb8a56f54ce1d7882326838d950b5cd8cdd141725",